{
  "$schema": "https://json-schema.org/draft/2020-12/schema",
  "$id": "https://nexgenstemschool.com.au/schemas/nexgen-quiz.v1.schema.json",
  "title": "NexgenQuizV1",
  "type": "object",
  "additionalProperties": false,
  "required": ["schemaVersion", "title", "yearLevel", "settings", "questions"],
  "properties": {
    "schemaVersion": {
      "type": "string",
      "const": "nexgen-quiz.v1"
    },
    "title": {
      "type": "string",
      "minLength": 3,
      "maxLength": 120
    },
    "description": {
      "type": "string",
      "maxLength": 1000
    },
    "topic": {
      "type": "string",
      "minLength": 2,
      "maxLength": 80
    },
    "tags": {
      "type": "array",
      "items": { "type": "string", "minLength": 1, "maxLength": 30 },
      "maxItems": 12,
      "uniqueItems": true
    },
    "yearLevel": {
      "type": "object",
      "additionalProperties": false,
      "required": ["min", "max"],
      "properties": {
        "min": { "type": "integer", "minimum": 7, "maximum": 10 },
        "max": { "type": "integer", "minimum": 7, "maximum": 10 }
      }
    },
    "settings": {
      "type": "object",
      "additionalProperties": false,
      "required": ["questionCount", "choicesPerQuestion"],
      "properties": {
        "questionCount": { "type": "integer", "const": 5 },
        "choicesPerQuestion": { "type": "integer", "const": 4 },
        "shuffleAnswers": { "type": "boolean", "default": false },
        "timeLimitMinutes": { "type": "integer", "minimum": 0, "maximum": 180 },
        "allowedAttempts": { "type": "integer", "minimum": 1, "maximum": 10 }
      }
    },
    "questions": {
      "type": "array",
      "minItems": 5,
      "maxItems": 5,
      "items": {
        "$ref": "#/$defs/question"
      }
    },
    "source": {
      "type": "object",
      "additionalProperties": false,
      "properties": {
        "prompt": { "type": "string", "maxLength": 4000 },
        "generator": { "type": "string", "maxLength": 120 },
        "generatedAtUtc": { "type": "string", "format": "date-time" }
      }
    }
  },
  "allOf": [
    {
      "type": "object",
      "properties": {
        "yearLevel": {
          "type": "object",
          "properties": {
            "max": { "type": "integer", "minimum": { "$data": "1/min" } }
          }
        }
      }
    }
  ],
  "$defs": {
    "question": {
      "type": "object",
      "additionalProperties": false,
      "required": ["id", "type", "prompt", "choices", "correctIndex"],
      "properties": {
        "id": {
          "type": "string",
          "pattern": "^Q[1-5]$"
        },
        "type": {
          "type": "string",
          "const": "multiple_choice"
        },
        "prompt": {
          "type": "string",
          "minLength": 5,
          "maxLength": 500
        },
        "choices": {
          "type": "array",
          "minItems": 4,
          "maxItems": 4,
          "items": {
            "type": "string",
            "minLength": 1,
            "maxLength": 200
          }
        },
        "correctIndex": {
          "type": "integer",
          "minimum": 0,
          "maximum": 3
        },
        "explanation": {
          "type": "string",
          "maxLength": 600
        },
        "difficulty": {
          "type": "string",
          "enum": ["easy", "medium", "hard"]
        },
        "outcomeTags": {
          "type": "array",
          "items": { "type": "string", "minLength": 1, "maxLength": 40 },
          "maxItems": 6,
          "uniqueItems": true
        }
      }
    }
  }
}
